{"schema_version":"1","scope_id":"scope-001","agdf_run_id":"agdf-run-001","approval_ref":".agdf/control/artefacts/demo/UR.md#project-inventory-scope","approval_gate":"UR","approval_revision_id":"11111111-1111-4111-8111-111111111111","decision_context":"Decide whether modernization planning can start.","allowed_outputs":["assessment_intake","inventory_report"],"source_boundary":{"repository_roots":["."],"external_systems":[],"exclusions":["secrets"]},"confidentiality":"internal"}
